course_prefix,course_number,course_title,course_desc,dept_name,inst_ipeds,metadata
Com,2185,Intermediate UX/UI Design with ADA Compliance,"Elevate your design skills in this comprehensive intermediate course focused on UX/UI principles with a strong emphasis on ADA compliance. Over the scheduled weeks, you'll explore essential design techniques, advanced research methods, and the importance of accessibility in creating user-centered experiences. Dive deep into wireframing, prototyping, and visual design while learning to implement best practices that adhere to the Americans with Disabilities Act and Web Content Accessibility Guidelines. Through hands-on projects, usability testing, and group discussions, you’ll develop a robust portfolio piece that showcases your ability to design inclusive, accessible digital products. Join us to create engaging interfaces that cater to all users, ensuring that your designs are not only beautiful but also functional and compliant.",Pacific Center for Advanced Technology Training,383190,"Course Outline: 

Learner Outcomes: 

Prerequisites: Must complete Introduction to UX/UI or equivalent based onthe basics of UX/UI design and principles of ADA compliance.Tech Requirements:Computer: Reliable with high-speed internet.Camera & Microphone: For online class through ZoomSoftware Savvy: Downloading, installing, and web browsing with different browsers.Zoom Ready: Camera always on.

Section Notes: No meeting: January 19, 2026 and February 23, 2026"
Com,2173,Website Design & Development: Creating E-Commerce Sites,"In this project-based, hands-on course, you will learn to create a basic e-commerce website. Topics include the home page, product and about pages, shopping cart, contact, and privacy policy pages.",Pacific Center for Advanced Technology Training,383190,
Com,2135,Programming Essentials in Python (PCEP),"This course introduces universal computer programming concepts such as data types, containers, functions, conditions, loops, as well as Python programming language syntax, semantics, and the runtime environment. Upon course completion with additional self-study, participants will be prepared to take the PCEP - Certified Entry-Level Python Programmer certification.",Pacific Center for Advanced Technology Training,383190,"Course Outline: This course introduces universal computer programming concepts such as data types, containers, functions, conditions, loops, as well as Python programming language syntax, semantics, and the runtime environment. Upon course completion with additional self-study, participants will be prepared to take the PCEP - Certified Entry-Level Python Programmer certification.

Learner Outcomes: 

Prerequisites: 1. Must be an experienced computer user.2. Previous knowledge of programming languages is helpful, but not required.3. Must have access to a computer/laptop with camera and microphone with robust Internet to access course materials and labs.

Section Notes: PCEP certification exam is included with training. Expect 5 weekly self-study hours.Certification exam is included with this course.No meetings on November 11, 2025 and November27, 2025"
Com,2175,Programming Essentials in Python (PCAP),"The Python PCAP course continues where Python PCEP ended. This hands-on course offers skills-based experience and prepares you for the PCAP - Certified Associate in Python programming certification. Skills covered in this course will be focused on object-oriented programming techniques such as creating modules and packages, working with file inputs and outputs, importing external packages and sharing packages. Training opens a path to the developer’s career.",Pacific Center for Advanced Technology Training,383190,"Course Outline: The Python PCAP course continues where Python PCEP ended. This hands-on course offers skills-based experience and prepares you for the PCAP - Certified Associate in Python programming certification. Skills covered in this course will be focused on object-oriented programming techniques such as creating modules and packages, working with file inputs and outputs, importing external packages and sharing packages. Training opens a path to the developer’s career.

Learner Outcomes: 

Prerequisites: 1. Completion of Python PCEP course or PCEP certification or equivalent knowledge and experience.2. Must have a computer/laptop with a camera and microphone and robust Internet.

Section Notes: Certification exam is included with this course.No meeting on March 26, 2026"
Com,2187,Introduction to AI for Workforce Development,"Dive into the world of artificial intelligence with our hands-on introductory course! This six-week training provides a comprehensive introduction to and exploration of AI fundamentals and their transformative role in workforce development. Using materials from the Intel AI for Workforce program and the Orange data mining software, you'll not only gain a solid grasp of AI concepts but also hands-on experience with the following:

AI Fundamentals: Start with the basics of Artificial Intelligence, diving into its core principles and real-world applications.
AI vs. Generative AI vs. Chatbots: Uncover the distinctions between these exciting technologies and their unique uses.
Practical Use Cases: Discover how AI is revolutionizing workforce sectors such as healthcare, finance, and more.
Open-Source Tools: Evaluate and compare tools like ChatGPT and Advanced Gemini, and learn how they enhance professional tasks.
Mathematical Computing: Get comfortable with SciPy and NumPy for data analysis and AI modeling.
Natural Language Processing (NLP): Understand the generation of NLP and its practical applications.
Engage in practical projects, like building chatbots, without needing any prior programming experience. This course emphasizes learning by doing, incorporating no-code tools and introductory Python coding to empower you to create your own AI applications.",Pacific Center for Advanced Technology Training,383190,
